{
  "contract_version": "0.1",
  "evaluation_id": "IC-ANAB-DCAS-001-PASS",
  "decision": "PASS",
  "evaluator": {
    "name": "dcas-reference-evaluator",
    "version": "0.1.0"
  },
  "findings": [
    {
      "requirement": "ANAB-FX-001:binding-current-and-verifiable",
      "result": "PASS",
      "reason": "Current binding/status evidence is available for the fixture.",
      "evidence_ids": ["binding-status", "freshness-status"]
    }
  ],
  "evidence_summary": {
    "consumed": ["binding-status", "freshness-status"],
    "missing": [],
    "rejected": []
  },
  "assurance": {
    "claimed": "Enterprise",
    "supported": "Enterprise"
  },
  "receipt_material": {
    "input_digest": "sha256:normalized-input-placeholder-for-fixture",
    "result_digest_algorithm": "sha256"
  }
}
